3,Piscis,Sun,Capricorn Ascendant,Sun in Piscis in 3,"When the SUN occupies this sign, the individual believes he has a secret mission in life. Such an individual usually associates himself with esoteric and occult organizations. He keeps respectful company and is regal in his relationships and in his attitude toward friends and relations. He knows his worth and his way. He is courageous and strong; he leads others and accepts none as his guide.",Owns Houses 8 and ,Piscis in 3,Sun in 3,Sun in Piscis,Capricorn Ascendant,316,,,,,,,,,,,,
3,Piscis,Moon,Capricorn Ascendant,Moon in Piscis in 3,"With the MOON in this sign, the individual loves the good life, good clothes and good food. He wants to entertain lavishly but is henpecked and homesick., very loving to his own people but always desirous of the company of the opposite sex.",Owns Houses 7 and ,Piscis in 3,Moon in 3,Moon in Piscis,Capricorn Ascendant,317,,,,,,,,,,,,
3,Piscis,Mercury,Capricorn Ascendant,Mercury in Piscis in 3,"MERCURY will make the individual sociable and talkative, but not very powerful. He has a spiritual world-view and prefers to lead an introverted life, though he can mix well with others.",Owns Houses 6 and 9,Piscis in 3,Mercury in 3,Mercury in Piscis,Capricorn Ascendant,318,,,,,,,,,,,,
3,Piscis,Venus,Capricorn Ascendant,Venus in Piscis in 3,"When VENUS occupies this sign, the individual is well-educated and artistic. He keeps company with other artists and talented persons. Pro­fessionally he is well placed, and eminent persons are counted among his friends.",Owns Houses 5 and 10,Piscis in 3,Venus in 3,Venus in Piscis,Capricorn Ascendant,319,,,,,,,,,,,,
3,Piscis,Mars,Capricorn Ascendant,Mars in Piscis in 3,"The individual becomes invincible when MARS occupies this sign. Generally he is pious but warm, ethical but courageous, devoted to ideals but attentive to his siblings and friends.",Owns Houses 4 and 11,Piscis in 3,Mars in 3,Mars in Piscis,Capricorn Ascendant,320,,,,,,,,,,,,
3,Piscis,Jupiter,Capricorn Ascendant,Jupiter in Piscis in 3,"When JUPITER occupies this sign, the individual is respectful and religious. He is a philanthropist, and therefore weak persons and individ­uals of depraved character flock to him, seeking advice and guidance. He himself believes in religious rituals and performs them assiduously.",Owns Houses 12 and 3,Piscis in 3,Jupiter in 3,Jupiter in Piscis,Capricorn Ascendant,321,,,,,,,,,,,,
3,Piscis,Saturn,Capricorn Ascendant,Saturn in Piscis in 3,"When SATURN occupies the 1bird house in Pisces, the individual is tormented in his personal life, but always protected. He gains special importance in foreign countries and many enduring friends come from abroad. His immediate surroundings, however, are not very pleasant.",Owns Houses 1 and 2,Piscis in 3,Saturn in 3,Saturn in Piscis,Capricorn Ascendant,322,,,,,,,,,,,,
3,Piscis,Rahu,Capricorn Ascendant,Rahu in Piscis in 3,"When RAHU occupies this sign, the individual is both spiritual and persevering. Although he talks of high ideals, he lives shabbily.",Owns Houses 7 and ,Piscis in 3,Rahu in 3,Rahu in Piscis,Capricorn Ascendant,323,,,,,,,,,,,,
3,Piscis,Ketu,Capricorn Ascendant,Ketu in Piscis in 3,"With KETU in this position, the individual has an original way of looking at and approaching the problems of life. He may be inclined toward alternative or unusual sexual relationships and is generally very lonely.",Owns Houses 12 and 3,Piscis in 3,Ketu in 3,Ketu in Piscis,Capricorn Ascendant,324,,,,,,,,,,,,
4,Aries,Sun,Capricorn Ascendant,Sun in Aries in 4,"But when the SUN occupies this sign in the Fourth house, a spark of fresh energy shines through the individual's life. He is capable of diving deeply into spiritual studies, for which he may unhesitatingly sacrifice his most cherished possessions. When his ambition is aroused and his imag­ination fired, he may strive for and achieve the highest goals in life. He will not follow tradition or historical precedent, but will break new ground. He will be a leader to his people and a patriarch to his family. He is always powerful, keeping the best company and enjoying singular honors.",Owns Houses 8 and ,Aries in 4,Sun in 4,Sun in Aries,Capricorn Ascendant,325,,,,,,,,,,,,
4,Aries,Moon,Capricorn Ascendant,Moon in Aries in 4,"The MOON quiets the impulsiveness of this Martian sign but may still produce things new and different. The individual seems quiet, receptive, and sociable, but internally he is always in tune with subtler forces. Exceptional psychic ability is common, for there are no boundaries or walls to prevent the upsurge of the karmic past. Consequently, ill luck and auspicious events are equally likely to manifest. There will always be a special subtlety, novelty, and sympathy in the personal relationships of such an individual. He will be affluent, live luxuriously, find marital happiness, and be religiously inclined.",Owns Houses 7 and ,Aries in 4,Moon in 4,Moon in Aries,Capricorn Ascendant,326,,,,,,,,,,,,
4,Aries,Mercury,Capricorn Ascendant,Mercury in Aries in 4,"MERCURY in this position will certainly make the individual intelligent, fond of traveling, and able to live well. He may feel the invisible hand of God guiding everything, but he will be unable or unwilling to respond wholeheartedly, and his life will generally be lived on a superficial level.",Owns Houses 6 and 9,Aries in 4,Mercury in 4,Mercury in Aries,Capricorn Ascendant,327,,,,,,,,,,,,
4,Aries,Venus,Capricorn Ascendant,Venus in Aries in 4,"VENUS will make the individual very libidinous, attracted to the opposite sex and fond of socializing. He will be artistic and susceptible to flattery. His attachment to his children, profession, and personal pleasures (especially of the sensual kind) will be great. He will be more poetic than logical, more excitable than intellectual, essentially a man of the world.",Owns Houses 5 and 10,Aries in 4,Venus in 4,Venus in Aries,Capricorn Ascendant,328,,,,,,,,,,,,
4,Aries,Mars,Capricorn Ascendant,Mars in Aries in 4,"With MARS in the Fourth house in Aries, the individual will be exceptional in many ways. He will have the aura of greatness, whatever happens to him, it will never be orthodox, traditional, or routine. His heart will be full of warmth which cannot be restricted to his immediate family surroundings. He can never be accused of parochialism or nepotism: there will be a feeling of universality in whatever he does, feds, or experiences. His warmth is at times misunderstood: his spouse may accuse him of infidelity, his boss may judge him unstable, and his friends may consider him frivolous and inconsistent. All these reactions arise from his inherent urge for the new, his warmth towards everyone, and his tremendous desire to mingle with all. His tendency may be expressed as vision, psychic sensitivity, or a truly tantric sexuality. He will have a natural affinity with Mother Earth: he will love to work on the land, possess much landed property, live in eccentric houses, and arrive at conclusions without bothering about reason or deduction. He will never depend on anyone else, on any outside or external support. His individuality will gain him the honor and respect of the government. He will be wealthy but prone to extravagance.",Owns Houses 4 and 11,Aries in 4,Mars in 4,Mars in Aries,Capricorn Ascendant,329,,,,,,,,,,,,
4,Aries,Jupiter,Capricorn Ascendant,Jupiter in Aries in 4,"JUPITER in this sign will make the individual popular, sympathetic, religious, god-fearing, and engaged in a respectful vocation. His relatives will look to him for support, guidance, and even sustenance. He may actually be deceived by his siblings and other relatives, and will often be afflicted by illness. He is likely to become famous outside his own country or place of birth.",Owns Houses 12 and 3,Aries in 4,Jupiter in 4,Jupiter in Aries,Capricorn Ascendant,330,,,,,,,,,,,,
4,Aries,Saturn,Capricorn Ascendant,Saturn in Aries in 4,"SATURN in the Fourth house in Aries produces an extremely unhelpful influence. Any benefic forces radiating from the karmic past are obscured by this planet, and the individual gropes in the dark as if blindfolded. Depression and depravity often descend upon him so that he is neither aware of his divine inheritance nor of his glorious destiny. His life is full of suffering, and his dark clouds loom so thick that he may sink into serious depression or abandon civilized society and traditional social decorum. Physically, he is likely to be afflicted with several ailments, perhaps including heart attacks. Psychologically he feels lonely, forlorn, unable to think logically, and bereft of all auspicious benedictions. He may be involved in litigation and surrounded by hostile forces. His mother suffers on his account; he receives neither love nor affection from her. In spite of these adverse influences, the individual may become wealthy, though he will probably be tied to the material plane. He may also be cruel, keep bad company, or suffer dishonor.",Owns Houses 1 and 2,Aries in 4,Saturn in 4,Saturn in Aries,Capricorn Ascendant,331,,,,,,,,,,,,
4,Aries,Rahu,Capricorn Ascendant,Rahu in Aries in 4,"The effect of R.AHU is adverse here. Under its influence, the individual will be deserted by his relatives, depressed by disposition, and will live in a sub-standard house.",Owns Houses 7 and ,Aries in 4,Rahu in 4,Rahu in Aries,Capricorn Ascendant,332,,,,,,,,,,,,
4,Aries,Ketu,Capricorn Ascendant,Ketu in Aries in 4,"Under the influence of KETU, the individual may become disturbed, lonely, and contemplative.",Owns Houses 12 and 3,Aries in 4,Ketu in 4,Ketu in Aries,Capricorn Ascendant,333,,,,,,,,,,,,
4,Taurus,Sun,Aquarius Ascendant,Sun in Taurus in 4,"When the SUN occupies Taurus in the Fourth house, the individual receives a kind of energy which, if properly directed, can make him regal in appearance and disposition. His aura exudes a sense of power and strength which impels others to yield to his wishes. I le may easily become an egotist. Instead of enjoying his mother's affection, he may lose her altogether, for the intense solar rays ""bum up"" this particular relationship. The solar radiance which so often produces universal empathy may, in the present case, generate so much virile energy that the individual becomes uncontrollably libidinous. He will be extremely fond of passion­ ate sexual affairs and will indulge in several secret relationships. He will be very intelligent, enjoy extensive property, and move from one place to another in quick succession.",Owns Houses 7 and ,Taurus in 4,Sun in 4,Sun in Taurus,Aquarius Ascendant,334,,,,,,,,,,,,
4,Taurus,Moon,Aquarius Ascendant,Moon in Taurus in 4,"The MOON will bestow such soothing charm that the individual can carry his innate spiritual wisdom and power with ease, in fact his power and stamina are often invisible behind the screen of his humility and simplicity. He will have a tremendous capacity to delve deep into nature's mysteries. His intuitive understanding will transcend all comprehension. Emotionally he will be very stable, yet sensitive to the slightest changes in his environment. He can taste the food of the gods, drink nature•s nectar, and in1part a healing touch to the most disturbed person. He will have insight in administering herbal medicines and, if he exerts himself, learn to counteract and treat the effects of poisonous drugs. He may easily attain the kind of perfection in magic which enables him to cure snake bite, exorcise evil spirits, and prepare the alchemical potions capable of counterbalancing planetary affliction The Moon in the fourth house in Taurus makes a person respectable, honored by society, the state, and the wise. What is important is to notice how his eminence, wisdom, and power are carried lightly and without ostentation.",Owns Houses 6 and ,Taurus in 4,Moon in 4,Moon in Taurus,Aquarius Ascendant,335,,,,,,,,,,,,
4,Taurus,Mercury,Aquarius Ascendant,Mercury in Taurus in 4,"MERCURY in this position will make a person very intelligent and clever. He will live with ease and comfort :1nd wilt favor it•arn: people who are critical of the existing order. Among themselves this group will indulge in many secret vices and socially undesirable activities. The individual may get into trouble due to his association with such a group. He will be unhealthy, prone to several kinds of illnesses, and will travel much.",Owns Houses 5 and 8,Taurus in 4,Mercury in 4,Mercury in Taurus,Aquarius Ascendant,336,,,,,,,,,,,,
4,Taurus,Venus,Aquarius Ascendant,Venus in Taurus in 4,"VENUS will make the individual comfort-loving, luxuries,, and re­spectful towards learned or religious persons. He himself may not be capable of undertaking severe religious austerities, but he will reverence those who are capable. He will be very honored by the state and the people, but his sensual nature, sensitivity, and love for artistic things will draw him towards sexual indulgences. He will be lusty and libidinous, but in whatever he does there will be grace, discrimination, and a serious attitude. He will be considered a leader of his people and will be capable of sustaining them through periods of difficulty.",Owns Houses 4 and 9,Taurus in 4,Venus in 4,Venus in Taurus,Aquarius Ascendant,337,,,,,,,,,,,,
4,Taurus,Mars,Aquarius Ascendant,Mars in Taurus in 4,"MARS in the Fourth house in Taurus produces warm feelings and bestows much landed property and real estate, but the individual's sexual desires will be uncontrollable. He will be immersed in bad company. driven to work for social and material advancement, even if by unethical means. Materially he will be well off, but there will always be the desire to acquire more and more. His most important characteristic is his insatiable thirst for life.",Owns Houses 3 and 10,Taurus in 4,Mars in 4,Mars in Taurus,Aquarius Ascendant,338,,,,,,,,,,,,
4,Taurus,Jupiter,Aquarius Ascendant,Jupiter in Taurus in 4,"JUPITER will make the individual's life very comfortable, rich and respectable. Though he will be learned in sacred scriptures, many swindlers and rogues will seek his advice. His status in society will be honorable, but his ego will be covetous, even towards other people’s  spouses.",Owns Houses 11 and 2,Taurus in 4,Jupiter in 4,Jupiter in Taurus,Aquarius Ascendant,339,,,,,,,,,,,,
4,Taurus,Saturn,Aquarius Ascendant,Saturn in Taurus in 4,"SATURN can make a person very cruel, greedy, miserly and burdened with family responsibilities. Such an individual will try to be very clever and outdo others who are living a conventional life; his own approach to life will be materialistic, for he seeks sensual pleasure in every situation. He will receive serious setbacks; emotionally he will be much perturbed. Generally he will be poor, though in the latter part of life he may be better off.",Owns Houses 12 and 1,Taurus in 4,Saturn in 4,Saturn in Taurus,Aquarius Ascendant,340,,,,,,,,,,,,
4,Taurus,Rahu,Aquarius Ascendant,Rahu in Taurus in 4,"When RAHU occupies this position, the person is wealthy, but he will not receive any affection from his mother. There will be some desire in his life which can never be completely satisfied, and he will always pine for what he doesn't have.",Owns Houses 6 and ,Taurus in 4,Rahu in 4,Rahu in Taurus,Aquarius Ascendant,341,,,,,,,,,,,,
4,Taurus,Ketu,Aquarius Ascendant,Ketu in Taurus in 4,"With KETU, an occultist is born. Life holds no charms for him and he is always preoccupied in exploring the secrets of nature: emotion, sensual pleasure, human relationships and material riches hold no attraction for him. His greatest joy arises only when his consciousness is united with the universal consciousness, though in ordinary life such an integration is difficult to achieve.",Owns Houses 11 and 2,Taurus in 4,Ketu in 4,Ketu in Taurus,Aquarius Ascendant,342,,,,,,,,,,,,
4,Gemini,Sun,Piscis Ascendant,Sun in Gemini in 4,"When the SUN occupies this sign, the individual struggles against hostile forces but overcomes them. He is intelligent and capable of pursuing the deeper problems o life effectively, but he is cut off from his mother's love. He rises high in his career and acquires much prestige in life. He is, however, not much recognized for consistency in his relation­ ships.",Owns Houses 6 and ,Gemini in 4,Sun in 4,Sun in Gemini,Piscis Ascendant,343,,,,,,,,,,,,
4,Gemini,Moon,Piscis Ascendant,Moon in Gemini in 4,"The MOON produces a nurturing environment It makes the individual contented, well-educated, sensitive, supportive to his family members and fond of physical comforts and sensual pleasures. His affections are well-balanced; his warmth is modulated by social decorum and personal fidelity and his wealth seldom gives him a swollen head. He is a respected and honorable figure, but this does not make him arrogant or inconsider­ate.",Owns Houses 5 and ,Gemini in 4,Moon in 4,Moon in Gemini,Piscis Ascendant,344,,,,,,,,,,,,
4,Gemini,Mercury,Piscis Ascendant,Mercury in Gemini in 4,"MERCURY in this sign signifies greatness and maturity of the soul. Essentially a family man, enjoying an amiable environment and pursuing his intellectual studies and vocation, such a person enjoys respectability and honor from the government. He is healthy. renowned, wealthy, and contented. He becomes in some way a leader of the community in which he resides.",Owns Houses 4 and 7,Gemini in 4,Mercury in 4,Mercury in Gemini,Piscis Ascendant,345,,,,,,,,,,,,
4,Gemini,Venus,Piscis Ascendant,Venus in Gemini in 4,"When VENUS occupies this sign and house, the person enjoys a",Owns Houses 3 and 8,Gemini in 4,Venus in 4,Venus in Gemini,Piscis Ascendant,346,,,,,,,,,,,,
4,Gemini,Mars,Piscis Ascendant,Mars in Gemini in 4,"MARS affects the individual in a radically different manner. lt produces warmth in social relationships, bestows material wealth and property: he earns :ram land and agriculture, technological knowledge, and courageous behavior. He has great stamina and a capacity for explor­ing new areas of experience, but for marital happiness t is not an auspicious placement.",Owns Houses 2 and 9,Gemini in 4,Mars in 4,Mars in Gemini,Piscis Ascendant,347,,,,,,,,,,,,
4,Gemini,Jupiter,Piscis Ascendant,Jupiter in Gemini in 4,"With JUPITER in this position the individual has an excellent family life. He is well-respected, his relationship with his mother is very happy, and his children are promising future citizens of the country. He is sober, well-balanced, wealthy, and leads a religious life.",Owns Houses 10 and 1,Gemini in 4,Jupiter in 4,Jupiter in Gemini,Piscis Ascendant,348,,,,,,,,,,,,
4,Gemini,Saturn,Piscis Ascendant,Saturn in Gemini in 4,"SATURN makes the individual more self-centered, interested purely",Owns Houses 11 and 12,Gemini in 4,Saturn in 4,Saturn in Gemini,Piscis Ascendant,349,,,,,,,,,,,,
4,Gemini,Rahu,Piscis Ascendant,Rahu in Gemini in 4,"RAHU can make the individual very intriguing end intelligent, though he will be frequently depressed as if beset with inmense difficulties.",Owns Houses 5 and ,Gemini in 4,Rahu in 4,Rahu in Gemini,Piscis Ascendant,350,,,,,,,,,,,,
4,Gemini,Ketu,Piscis Ascendant,Ketu in Gemini in 4,"KETU makes a person psychologically sensitive. His mind will be sharp, and he will be attracted towards philosophy. His emotional nature, however, will be barren.",Owns Houses 10 and 1,Gemini in 4,Ketu in 4,Ketu in Gemini,Piscis Ascendant,351,,,,,,,,,,,,
4,Cancer,Sun,Aries Ascendant,Sun in Cancer in 4,"When the SUN is here, the individual is immersed in spiritual realiza­tion and cares little about acquiring property, material riches, or social approbation. He possesses a good house and is well-educated, but is not terribly attached to his mother. Once he decides on a specific goal, he approaches it wholeheartedly and consequently achieves it.",Owns Houses 5 and ,Cancer in 4,Sun in 4,Sun in Cancer,Aries Ascendant,352,,,,,,,,,,,,
4,Cancer,Moon,Aries Ascendant,Moon in Cancer in 4,"The MOON provides an opportunity for acquiring spiritual knowl­edge, and the individual with this placement may even come to possess powers, but he remains essentially a family man. He is fond of his relatives, amiable in disposition, forgiving by temperament, and loves travel.",Owns Houses 4 and ,Cancer in 4,Moon in 4,Moon in Cancer,Aries Ascendant,353,,,,,,,,,,,,
4,Cancer,Mercury,Aries Ascendant,Mercury in Cancer in 4,"MERCURY creates several problems in the life of the person, who is required to establish a bridge between the realities of his life and his visionary ideals. He has the intelligence to achieve such a synthesis, but problems with siblings may stand in his way, and his health is likely to be weak. However, he travels much, visits a large number of places, and may choose a vocation involving boats, hydro-electric engineering, or water in general. His relationship with his mother is affectionate, and his temperament is usually emotional.",Owns Houses 3 and 6,Cancer in 4,Mercury in 4,Mercury in Cancer,Aries Ascendant,354,,,,,,,,,,,,
4,Cancer,Venus,Aries Ascendant,Venus in Cancer in 4,"VENUS shapes a person who is very much attached to his spouse and family relations. He is rich, lives in a luxurious environment, and is very affable. He has a pronounced artistic temperament, is quite popular, fond of the opposite sex, and much honored. He rises in his profession.",Owns Houses 2 and 7,Cancer in 4,Venus in 4,Venus in Cancer,Aries Ascendant,355,,,,,,,,,,,,
4,Cancer,Mars,Aries Ascendant,Mars in Cancer in 4,"But with MARS occupying this sign, the individual becomes abnor­mally restless, fails in real estate, and gets into trouble due to his sexual relationships. He quarrels with his family, is estranged from his mother, and has troubles in marital life. Professionally, however, he is likely to rise quickly and become extravagant.",Owns Houses 1 and 8,Cancer in 4,Mars in 4,Mars in Cancer,Aries Ascendant,356,,,,,,,,,,,,
4,Cancer,Jupiter,Aries Ascendant,Jupiter in Cancer in 4,"A completely different kind of situation is present with JUPITER occupying the Fourth in Cancer. The individual is renowned for his composure of mind, attains status in local government, and is provided with all the conveniences of life. His demeanor is almost regal and his understanding of spiritual matters exemplary. His children are very prom­ising, and he is surrounded by people who are full of affection and regard for him.",Owns Houses 9 and 12,Cancer in 4,Jupiter in 4,Jupiter in Cancer,Aries Ascendant,357,,,,,,,,,,,,
4,Cancer,Saturn,Aries Ascendant,Saturn in Cancer in 4,"SATURN in Cancer brings greatness and fame, but the kind of social position acquired under this planetary placement is based solely upon material attainments. Professionally, the person attains a high position, but he may well suffer a catastrophic fall from that height, causing serious psychological damage. He experiences many setbacks in life, especially physical illness and poverty, and must suffer the death of some of his near and dear ones. He begins life with selfishness, but faces so many problems and breakdowns that he develops a radically detached view of situations and relationships.",Owns Houses 10 and 11,Cancer in 4,Saturn in 4,Saturn in Cancer,Aries Ascendant,358,,,,,,,,,,,,
4,Cancer,Rahu,Aries Ascendant,Rahu in Cancer in 4,"When RAHU occupies this sign, the individual becomes depressive and interested in black magic. He has trouble with his family and is denied his mother's affection.",Owns Houses 4 and ,Cancer in 4,Rahu in 4,Rahu in Cancer,Aries Ascendant,359,,,,,,,,,,,,
4,Cancer,Ketu,Aries Ascendant,Ketu in Cancer in 4,"With KETU in this position, the individual lacks loving relationships. His life is full of troubles and his behavior is unpredictable. These troubles, however, render him very thoughtful and ultimately philosoph­ical.",Owns Houses 9 and 12,Cancer in 4,Ketu in 4,Ketu in Cancer,Aries Ascendant,360,,,,,,,,,,,,
4,Leo,Sun,Taurus Ascendant,Sun in Leo in 4,"With the SUN in this sign, the individual establishes a link with the very essence of existence, and consequently his capabilities for spiritual knowledge are greatly increased. His consciousness is almost identified with the universal consciousness, and a ray of divinity sparkles through his behavior and die.position. He attains a regal status and acquires property. His intellect is sharp, but very few people feel comfortable with him; even hie; mother is estranged from him.",Owns Houses 4 and ,Leo in 4,Sun in 4,Sun in Leo,Taurus Ascendant,361,,,,,,,,,,,,
4,Leo,Moon,Taurus Ascendant,Moon in Leo in 4,"The MOON in this sign makes the individual thoughtful and religious, but there is always some misunderstanding with his family, and he pines for love and affection. He has good status, a sound mind, and an amiable disposition, yet be does not feel happy within.",Owns Houses 3 and ,Leo in 4,Moon in 4,Moon in Leo,Taurus Ascendant,362,,,,,,,,,,,,
4,Leo,Mercury,Taurus Ascendant,Mercury in Leo in 4,"MERCURY makes the individual wealthy, well-related, intelligent, and fond of good company. He is also very demonstrative in his behavior, though his demonstrations don't really mean much. He travels extensively and can be a very absorbing conversationalist.",Owns Houses 2 and 5,Leo in 4,Mercury in 4,Mercury in Leo,Taurus Ascendant,363,,,,,,,,,,,,
4,Leo,Venus,Taurus Ascendant,Venus in Leo in 4,"When VENUS occupies Leo in the fourth house, the individual suffers from a guilty conscience: inwardly he is very affectionate, sensual, and fond of luxurious living, bat his immediate surroundings - conditioned by his parents"" disciplining force - urge him to renounce such pleasure. He attain.s status, good friends, and an abundance of goodwill and popularity, but his inner d<sires remain unsatisfied.",Owns Houses 1 and 6,Leo in 4,Venus in 4,Venus in Leo,Taurus Ascendant,364,,,,,,,,,,,,
