9,Aquarius,Jupiter,Gemini Ascendant,Jupiter in Aquarius in 9,"JUPITER m this sign will help the individual to explore the world of spirituality. He may perceive the indwelling spirit which guides and controls us all. His psychological impulse will be toward the progress of humanity rather than for himself alone. He will be a true saint, though without the trappings of monasticism.",Owns Houses 7 and 10,Aquarius in 9,Jupiter in 9,Jupiter in Aquarius,Gemini Ascendant,1068,,,,,,,,,,,,
9,Aquarius,Saturn,Gemini Ascendant,Saturn in Aquarius in 9,"SATURN in this sign produces a strong ego and the native's karma still ties him to the tether of the external. He is capable of undertaking arduous inquiries into such subjects as occultism, astrology, the effect of mantras; on the physical body and so on, but his basic motivation is material. He craves social prestige, material conveniences, and political power.",Owns Houses 8 and 9,Aquarius in 9,Saturn in 9,Saturn in Aquarius,Gemini Ascendant,1069,,,,,,,,,,,,
9,Aquarius,Rahu,Gemini Ascendant,Rahu in Aquarius in 9,"RAHU in this sign involves the individual in magic, alchemy. and the cure of physical ailments by the use of spiritual power.",Owns Houses 2 and ,Aquarius in 9,Rahu in 9,Rahu in Aquarius,Gemini Ascendant,1070,,,,,,,,,,,,
9,Aquarius,Ketu,Gemini Ascendant,Ketu in Aquarius in 9,KETU will disturb the mental balance of the individual and he will quite often be in conflict with others. His ideas will clash with those of the people around him even when he is right. This will happen because his ideas will lean towards understanding the spiritual laws of nature.,Owns Houses 7 and 10,Aquarius in 9,Ketu in 9,Ketu in Aquarius,Gemini Ascendant,1071,,,,,,,,,,,,
9,Piscis,Sun,Cancer Ascendant,Sun in Piscis in 9,"When the SUN is in this sign, the native struggles continually to improve his personal life, while remaining fully aware of his responsibil­ities to society. He often distances himself from his siblings and relations. He pursues studies in subjects which are beyond the realm of ordinary vision and generally succeds in his life's mission.",Owns Houses 2 and ,Piscis in 9,Sun in 9,Sun in Piscis,Cancer Ascendant,1072,,,,,,,,,,,,
9,Piscis,Moon,Cancer Ascendant,Moon in Piscis in 9,"The MOON in this sign not only bestows respectability. it also produces clarity of vision and a deep, penetrating mind. The native's personal conduct is ideal; he is fully conscious of his individuality and the need to develop its potential to the full.",Owns Houses 1 and ,Piscis in 9,Moon in 9,Moon in Piscis,Cancer Ascendant,1073,,,,,,,,,,,,
9,Piscis,Mercury,Cancer Ascendant,Mercury in Piscis in 9,"MERCURY in this sign will develop the native's intellectual capacity to a very high level. His fame spreads far and wide and he will be much sought after by his friends and colleagues. He will be helpful, and will always have faith that his own understanding and conclusions about things are more valid than the traditional outlook.",Owns Houses 12 and 3,Piscis in 9,Mercury in 9,Mercury in Piscis,Cancer Ascendant,1074,,,,,,,,,,,,
9,Piscis,Venus,Cancer Ascendant,Venus in Piscis in 9,"VENUS, being exalted in this sign, bestows very auspicious results by way of providing status, socia) responsibilities, and a sound mind. The individual will be very helpful. However, his faith in conventional religion will be shaky.",Owns Houses 11 and 4,Piscis in 9,Venus in 9,Venus in Piscis,Cancer Ascendant,1075,,,,,,,,,,,,
9,Piscis,Mars,Cancer Ascendant,Mars in Piscis in 9,"MARS in this sign is one of the most powerful planets for producing a new approach to life. The individual always dominates, wherever he may be. His interest in earning a living will be minimal and his entire life will be a kind of mission. He will always be creative, never wasting a single moment, for he will always be acting consciously and purposefully at whatever level of existence. He will succeed in externalizing many of the hidden aspects of life. He will appear in the world suddenly and will vanish in the same way. He will be a kind of spiritual king.",Owns Houses 10 and 5,Piscis in 9,Mars in 9,Mars in Piscis,Cancer Ascendant,1076,,,,,,,,,,,,
9,Piscis,Jupiter,Cancer Ascendant,Jupiter in Piscis in 9,"With JUPITER in this sign, the individual will be deeply committed to ancient history, traditional religion, and the revival of spiritual culture. He will confront many difficulties, and will succeed in the manifestation of certain memorable aspects of life. He will, however, be involved in several mundane responsibilities, as a result of which he will have very little time for self-improvement.",Owns Houses 6 and 9,Piscis in 9,Jupiter in 9,Jupiter in Piscis,Cancer Ascendant,1077,,,,,,,,,,,,
9,Piscis,Saturn,Cancer Ascendant,Saturn in Piscis in 9,"SATURN will produce an occultist who will need nothing for his sustenance. He will be immersed in spiritual exploration and inquiry. He will succeed in retrieving many secrets of nature. His personal life will be a mystery; isolated from society, he will join his mind with his innermost essence, making him appear to be a kind of sleepwalker.",Owns Houses 7 and 8,Piscis in 9,Saturn in 9,Saturn in Piscis,Cancer Ascendant,1078,,,,,,,,,,,,
9,Piscis,Rahu,Cancer Ascendant,Rahu in Piscis in 9,"RAHU will make the individual a great spiritualist in the sense that he will understand the significance of esoteric md exoteric religions. Though he himself will adhere to some esoteric form of spirituality, he will emphasize the value- of traditional religion in his dealings with ordinary people.",Owns Houses 1 and ,Piscis in 9,Rahu in 9,Rahu in Piscis,Cancer Ascendant,1079,,,,,,,,,,,,
9,Piscis,Ketu,Cancer Ascendant,Ketu in Piscis in 9,"With KETU in this sign, the individual loses all sectarian feelings and succeeds in acquiring the spirit of universalism. He sees the essential reality of different faiths. In the realm of ideas, bigotry and narrow-mind­edness are eliminated. Though he will be fully aware of the strong and weak points of different approaches to religion, he will practice non-interference and his greatest qualities will be integrity of character and honesty of thought.",Owns Houses 6 and 9,Piscis in 9,Ketu in 9,Ketu in Piscis,Cancer Ascendant,1080,,,,,,,,,,,,
10,Aries,Sun,Cancer Ascendant,Sun in Aries in 10,"The SUN in this sign makes the individual a fearless explorer in the spiritual realm, from which he will retrieve some priceless gem for the benefit of mankind. He will have the vitality to undertake an arduous mission, and to carry it forth unaided if the need arises. He will conquer all his adversaries, and if necessary continue his pilgrimage all alone. He knows how to stand alone; the world follows him later.",Owns Houses 2 and ,Aries in 10,Sun in 10,Sun in Aries,Cancer Ascendant,1081,,,,,,,,,,,,
10,Aries,Moon,Cancer Ascendant,Moon in Aries in 10,"The MOON in this sign makes the individual a great benefactor of humanity. Reflecting clearly what the divine plan unfolds for different people and the sufferings they all have to experience, the Moon in Aries in the Tenth will impress upon its native how best to guide them. The individual may not be a great oracle or seer, but he will be a person who personifies compassion, who will sympathetically encourage those in distress to persist on the path of righteousness. The relationship of the individual with society will be harmonious and he will receive much regard from the people. His personal life may not be a bed of roses, but to others he will make life worth living, instilling in them the spirit of fortitude and optimism.",Owns Houses 1 and ,Aries in 10,Moon in 10,Moon in Aries,Cancer Ascendant,1082,,,,,,,,,,,,
10,Aries,Mercury,Cancer Ascendant,Mercury in Aries in 10,"MERCURY in Aries in the Tenth will make the individual a great logician, unsurpassable in debate and discussions. Working outside his homeland, he will discuss the hidden aspects of life and will succeed in producing publications which will be of enduring value. The novelty of his approach, his down-to-earth analysis and vigor, as well as his lan­guage, will be exceptionally simple but chaste. In his personal relation­ ships, he will be equally at e.ase with adversaries and friends.",Owns Houses 12 and 3,Aries in 10,Mercury in 10,Mercury in Aries,Cancer Ascendant,1083,,,,,,,,,,,,
10,Aries,Venus,Cancer Ascendant,Venus in Aries in 10,"When VENUS occupies this sign, the native is very passionate and thus comes into direct contact with people; his primary contact with society arises from his sensitivity to the weaknesses and needs of others. The fine arts, musical talent, painting and dancing are some of the possible expressions of the inner experience of beauty which surrounds this individual, but the precise form in which the experience is externalized will depend upon the individual's perception of what society needs at the moment. It may take shapes as diverse as religious teaching and guidance on one hand, or prostitution and pornography on the other, or it could simply make the native very cooperative in the office. What is important is sensitivity to the nee<ls, weaknesses and desires of other people. With this position of Venus, there will invariably be tremendous strain on the individual, which may le.ad to nervous breakdown or some other psycho­ physical reaction to social interaction.",Owns Houses 11 and 4,Aries in 10,Venus in 10,Venus in Aries,Cancer Ascendant,1084,,,,,,,,,,,,
10,Aries,Mars,Cancer Ascendant,Mars in Aries in 10,"MARS in this sign will make the individual indomitable, always victorious over his enemies, and capable of surmounting any obstacle. Restlessness will be pronounced. The native will feel miserable if he has nothing to do, and only that which makes him physically active and useful to society through identification with an ideal or a cause can satisfy him. He will be successful, whether in civic life or on the battlefield. He must have a challenge, involvement, and a cause for which to live.",Owns Houses 10 and 5,Aries in 10,Mars in 10,Mars in Aries,Cancer Ascendant,1085,,,,,,,,,,,,
10,Aries,Jupiter,Cancer Ascendant,Jupiter in Aries in 10,"JUPITER will enable the individual to develop his personal qualities. He will not lack courage and valor, but his primary achievements will be in the spiritual life. He will be learned, obedient to his parents and the state; his actions will be ethical, and he will always be engaged in doing good to others, even when others are uncharitable to him.",Owns Houses 6 and 9,Aries in 10,Jupiter in 10,Jupiter in Aries,Cancer Ascendant,1086,,,,,,,,,,,,
10,Aries,Saturn,Cancer Ascendant,Saturn in Aries in 10,"SATURN will make the individual down-to-earth, measuring the use­ fulness of everything in terms of its impact on everyday living. Saturn itself will have the capacity to destroy everything that is personally satisfying to the individual, but will make him always conscious of the needs of the other person. Personally, his life will be much restricted, with all conveniences denied to him, but his mind will remain unimpaired, alert to the minutest detail and capable of setting right a badly damaged machine or a thoroughly broken human spirit. He will sometimes rise to sublime heights in whatever he does, but then fall, having been denied the essential material for success. Though he stands on solid ground, his mind dwells in the ether, and thus the solid earth beneath his feet suddenly collapses and he feels suspended in emptiness. This is how Saturn in debilitation makes the individual miserable materially in order to reveal to him his spiritual reality.",Owns Houses 7 and 8,Aries in 10,Saturn in 10,Saturn in Aries,Cancer Ascendant,1087,,,,,,,,,,,,
10,Aries,Rahu,Cancer Ascendant,Rahu in Aries in 10,RAHU in this sign makes the individual hard-boiled but zealous in whatever he does. He may become a religious fanatic.,Owns Houses 1 and ,Aries in 10,Rahu in 10,Rahu in Aries,Cancer Ascendant,1088,,,,,,,,,,,,
10,Aries,Ketu,Cancer Ascendant,Ketu in Aries in 10,"KETU will make the individual unable to enjoy any situation in which he is placed. He will instantly perceive the shallowness of any relationship and become detached. No situation can make him feel whole-heartedly involved, and thus he will always feel lost. He will be precocious, detached, and philosophical, all suggesting a lonely life.",Owns Houses 6 and 9,Aries in 10,Ketu in 10,Ketu in Aries,Cancer Ascendant,1089,,,,,,,,,,,,
10,Taurus,Sun,Leo Ascendant,Sun in Taurus in 10,"With the SUN in this sign there is great turmoil, and the individual",Owns Houses 1 and ,Taurus in 10,Sun in 10,Sun in Taurus,Leo Ascendant,1090,,,,,,,,,,,,
10,Taurus,Moon,Leo Ascendant,Moon in Taurus in 10,"The MOON in this sign and house will bestow some of its best results. The individual born wider this influence will have no adversaries. Who­ soever comes into his sphere will become his great admirer, friend, supporter, and perhaps even his follower. His arguments will be so persuasive that no one will think of opposing him. He will be a great organizer, and his renown and respectability will extend far and wide.",Owns Houses 12 and ,Taurus in 10,Moon in 10,Moon in Taurus,Leo Ascendant,1091,,,,,,,,,,,,
10,Taurus,Mercury,Leo Ascendant,Mercury in Taurus in 10,"MERCURY will make the individua! very rich, very much in demand socially, and possessed of a great intellect. No one will equal him in legal matters, as a debater he will always excel, and as a diplomatic negotiator he will be unrivaled. If he engages in commerce or business, he will earn a great deal of money. He will have few, if any, enemies.",Owns Houses 11 and 2,Taurus in 10,Mercury in 10,Mercury in Taurus,Leo Ascendant,1092,,,,,,,,,,,,
10,Taurus,Venus,Leo Ascendant,Venus in Taurus in 10,"VENUS in this sign is very powerful and bestows special merits on the individual. His abilities, sociability, and demeanor are so captivating that he will be a natural leader in society. Such a person is born into a particular family or society for some special purpose, and in the discharge of that task he enjoys easy success and enormous support from the people.",Owns Houses 10 and 3,Taurus in 10,Venus in 10,Venus in Taurus,Leo Ascendant,1093,,,,,,,,,,,,
10,Taurus,Mars,Leo Ascendant,Mars in Taurus in 10,"MARS in this sign makes the individual full of life, a great supporter of religious and social activities, a skilled surgeon, and a passionate lover. He raises the status of his family and society.",Owns Houses 9 and 4,Taurus in 10,Mars in 10,Mars in Taurus,Leo Ascendant,1094,,,,,,,,,,,,
10,Taurus,Jupiter,Leo Ascendant,Jupiter in Taurus in 10,"JUPITER in Taurus in the Tenth house will protect the social status of the individual and guide his progress in life through thick and thin. He will have admirable relationships with his children, family members, and elders. He will look after his parents and attain a very high status in his career. He will be wealthy. His interest in religious activities will be explicit, but his involvement in amorous alliances will also be noteworthy. But whatever he does, or in whatever situation he may find himself, there will be an invisible hand protecting his prestige and respectability.",Owns Houses 5 and 8,Taurus in 10,Jupiter in 10,Jupiter in Taurus,Leo Ascendant,1095,,,,,,,,,,,,
10,Taurus,Saturn,Leo Ascendant,Saturn in Taurus in 10,"SATURN in this sign will draw the individual towards occultism in the true sense of the word. His attainment in this field will be very high, but he will not display it to the world at large. He himself will be detached from everything external and material. He will be a great traveler and will consider the whole world his home. He will give comfort to others, but his life will seem barren, indigent, and full of hardships if measured only with the yardstick of material success.",Owns Houses 6 and 7,Taurus in 10,Saturn in 10,Saturn in Taurus,Leo Ascendant,1096,,,,,,,,,,,,
10,Taurus,Rahu,Leo Ascendant,Rahu in Taurus in 10,"RAHU in this position attains its exaltation, thereby bestowing all that is good and auspicious in this shadowy planet. The greatest contribution it makes is to enlighten the individual spiritually: initiation into secret religious orders is possible under this impulse. An individual under the impact of Rahu often makes a very just arbitrator, an efficient healer, and a great traveler. His external life is very simple, but his inner life is rich and full.",Owns Houses 12 and ,Taurus in 10,Rahu in 10,Rahu in Taurus,Leo Ascendant,1097,,,,,,,,,,,,
10,Taurus,Ketu,Leo Ascendant,Ketu in Taurus in 10,"KETU can make the individual confused or psychologically disturbed, and prone to alternative expressions of sexuality.",Owns Houses 5 and 8,Taurus in 10,Ketu in 10,Ketu in Taurus,Leo Ascendant,1098,,,,,,,,,,,,
10,Gemini,Sun,Virgo Ascendant,Sun in Gemini in 10,"The SUN in this sign will make the individual very bright, drawing him to an administrative career and illuminating his mind in such a way that he succeeds in attaining social status. His heart will be in his work and he will travel widely.",Owns Houses 12 and ,Gemini in 10,Sun in 10,Sun in Gemini,Virgo Ascendant,1099,,,,,,,,,,,,
10,Gemini,Moon,Virgo Ascendant,Moon in Gemini in 10,"When the MOON occupies Gemini in the Tenth, the individual be­ comes part of the social elite and is renowned for his literary genius. Such a person often becomes a poet, literary figure, or art critic. A successful chartered accountant, legal practitioner, businessman engaged in interna­tional trade and commerce, or a maritime insurance agent may often be found under this combination.",Owns Houses 11 and ,Gemini in 10,Moon in 10,Moon in Gemini,Virgo Ascendant,1100,,,,,,,,,,,,
10,Gemini,Mercury,Virgo Ascendant,Mercury in Gemini in 10,"MERCURY in this sign makes the individual soft-spoken, intelligent, a skillful negotiator, a legal expert, and highly social. Well-respected in society, considerate to family members and friends and an extensive traveler, such an individual generally leads society in some special field. ",Owns Houses 10 and 1,Gemini in 10,Mercury in 10,Mercury in Gemini,Virgo Ascendant,1101,,,,,,,,,,,,
10,Gemini,Venus,Virgo Ascendant,Venus in Gemini in 10,"With VENUS in this position, coveted social status comes unexpect­edly and money flows to the individual without any impediment. He is much respected and obeyed and his sociability and diplomacy are both of an extraordinary nature.",Owns Houses 9 and 2,Gemini in 10,Venus in 10,Venus in Gemini,Virgo Ascendant,1102,,,,,,,,,,,,
10,Gemini,Mars,Virgo Ascendant,Mars in Gemini in 10,"MARS in this position will make the individual disliked by his associates; he will be very argumentative. His technological skills and his spirit of exploration may not be recognized or rewarded, and his profes­sional career may sometimes fall under a cloud.",Owns Houses 8 and 3,Gemini in 10,Mars in 10,Mars in Gemini,Virgo Ascendant,1103,,,,,,,,,,,,
10,Gemini,Jupiter,Virgo Ascendant,Jupiter in Gemini in 10,"Through the influence of his spouse, the individual attains social and professional eminence when JUPITER occupies Gemini in the Tenth. Under this impulse the individual becomes religious in the conventional sense, and is devoted to both his mother and his guru. He is always protected in any kind of difficulty.",Owns Houses 4 and 7,Gemini in 10,Jupiter in 10,Jupiter in Gemini,Virgo Ascendant,1104,,,,,,,,,,,,
10,Gemini,Saturn,Virgo Ascendant,Saturn in Gemini in 10,SATURN will cause the children of the native lo attain eminence in a foreign land; he himself will be considered an expert in international law. Psychologically he will feel greatly fettered; he seldom receives opportu­nities to express his special expertise. Occasionally he suffers serious setbacks in his career.,Owns Houses 5 and 6,Gemini in 10,Saturn in 10,Saturn in Gemini,Virgo Ascendant,1105,,,,,,,,,,,,
10,Gemini,Rahu,Virgo Ascendant,Rahu in Gemini in 10,"RAHU shapes an individual who, under affliction, may be psycholog­ically unbalanced or engaged in surreptitious anti-social activities. He may not be respected in society and may be considered a dangerous person to associate with.",Owns Houses 11 and ,Gemini in 10,Rahu in 10,Rahu in Gemini,Virgo Ascendant,1106,,,,,,,,,,,,
10,Gemini,Ketu,Virgo Ascendant,Ketu in Gemini in 10,KETU in this sign and house implies a challenging situation with regard to the native's peace of mind and personal ethics. Other people may find it difficult to make friends with him.,Owns Houses 4 and 7,Gemini in 10,Ketu in 10,Ketu in Gemini,Virgo Ascendant,1107,,,,,,,,,,,,
10,Cancer,Sun,Libra Ascendant,Sun in Cancer in 10,"The SUN occupying this sign provides vitality to the native's social interaction. Intellectually, he is versatile to the point of genius. It is not just his social eminence which attracts people to him, but the fact that he himself is always concerned with helping and working for others. His sense of responsibility is enormous; whenever he accepts the responsibil­ity for any task, he will certainly see it to its successful completion. His organizing skill is so extraordinary, his personality so commanding, and his conduct so ethical that everyone from whom he requires service or work willingly cooperates with him.",Owns Houses 11 and ,Cancer in 10,Sun in 10,Sun in Cancer,Libra Ascendant,1108,,,,,,,,,,,,
10,Cancer,Moon,Libra Ascendant,Moon in Cancer in 10,"With the MOON in this sign, peace descends upon the individual. There is no tension in him, and whoever comes in contact with him feels specially charmed. He does not command, but he is so pious and sympa­thetic that his wish becomes more compelling than any direct order could be. His associates are of high intelligence, moral conduct, and purity of intention. In one•s associations, a persons own character may be re­flected, thus those who are of shady character fall out with the native. Professionally, he goes through changes; his output is variable; he travels extensively. He may write beautiful poetry blending mysticism and romance.",Owns Houses 10 and ,Cancer in 10,Moon in 10,Moon in Cancer,Libra Ascendant,1109,,,,,,,,,,,,
10,Cancer,Mercury,Libra Ascendant,Mercury in Cancer in 10,"MERCURY draws the native toward mundane relationships; there may be a display of affluence, interest in social status, mental exhibitionism and general covetousness. The individual under such an influence, how­ ever, will also be learned in religious scripture and classical literature. He will be widely known and attain eminence even in foreign countries.",Owns Houses 9 and 12,Cancer in 10,Mercury in 10,Mercury in Cancer,Libra Ascendant,1110,,,,,,,,,,,,
10,Cancer,Venus,Libra Ascendant,Venus in Cancer in 10,"When VENUS occupies this sign, there is a great urge for sensual pleasure and sexual gratification, which becomes the chief motivating factor in the native's social interactions. His interest and skill in the fine arts, his musical talent, and his eminent social status are all directed towards securing personal pleasure.",Owns Houses 8 and 1,Cancer in 10,Venus in 10,Venus in Cancer,Libra Ascendant,1111,,,,,,,,,,,,
10,Cancer,Mars,Libra Ascendant,Mars in Cancer in 10,"MARS in this sign will lead the individual away from altruism and immerse him in vigorously selfish material endeavors, earning more money and attaining more status. He will neglect his family, be unmindful of his children, and even risk his own health ill order to attain what be wants. His spouse will control his social and professional career.",Owns Houses 7 and 2,Cancer in 10,Mars in 10,Mars in Cancer,Libra Ascendant,1112,,,,,,,,,,,,
10,Cancer,Jupiter,Libra Ascendant,Jupiter in Cancer in 10,"JUPITER in Cancer in the Tenth house will bestow a career which is respectable, comfortable, and full of travel opportunities. The individual, however, will be primarily concerned with his family happiness. Contrary to general belief, the exaltation of Jupiter in the Tenth is not very conducive to mental peace, stability, social relationships, or smooth progress in one's profession. Often there is a dissatisfaction with material involvements; adversaries afflict the individual in a major way and his health suffers thereby. Considerable change and fluctuation occurs in his personal fortune.",Owns Houses 3 and 6,Cancer in 10,Jupiter in 10,Jupiter in Cancer,Libra Ascendant,1113,,,,,,,,,,,,
10,Cancer,Saturn,Libra Ascendant,Saturn in Cancer in 10,"SATURN in this position produces a person who has almost transcended the limitations of his personality and who is inspired to work for a cause. His detachment gives him vitality, clarity, and direction. This planetary position unifies the emotional nature with one•s training and with one's involvement in social interaction. The native commands great respect from people, especially because of his integrity of character.",Owns Houses 4 and 5,Cancer in 10,Saturn in 10,Saturn in Cancer,Libra Ascendant,1114,,,,,,,,,,,,
10,Cancer,Rahu,Libra Ascendant,Rahu in Cancer in 10,"RAHU is found in this sign and house only when the individual has some karmic mission in life. He is able to mobilize his followers and associates for the attainment of unconventional objects in life. Society may not see the wisdom of his activities and may even view him with some distaste, but the final outcome of his efforts will have an enduring effect. He regards himself as less important than h:s work, which he wants people to appreciate and recognize.",Owns Houses 10 and ,Cancer in 10,Rahu in 10,Rahu in Cancer,Libra Ascendant,1115,,,,,,,,,,,,
10,Cancer,Ketu,Libra Ascendant,Ketu in Cancer in 10,KETU leads to psychic perception; a sense of the unusual pervades,Owns Houses 3 and 6,Cancer in 10,Ketu in 10,Ketu in Cancer,Libra Ascendant,1116,,,,,,,,,,,,
