6,Virgo,Rahu,Aries Ascendant,Rahu in Virgo in 6,"	RAHU may distort the native's thinking process and put him in bad company, under the influence of which he will form many bad habits.",Owns Houses 4 and ,Virgo in 6,Rahu in 6,Rahu in Virgo,Aries Ascendant,701,,,,,,,,,,,,
6,Virgo,Ketu,Aries Ascendant,Ketu in Virgo in 6,"	KETU will make the native psychic, though he may also be obses­sional. He will be subject to possession by astral entities.",Owns Houses 9 and 12,Virgo in 6,Ketu in 6,Ketu in Virgo,Aries Ascendant,702,,,,,,,,,,,,
6,Libra,Sun,Taurus Ascendant,Sun in Libra in 6,	The SUN occupying this sign creates loss of property and humiliation for the individual. He is lured by sexual affairs which may destroy his social respectability.,Owns Houses 4 and ,Libra in 6,Sun in 6,Sun in Libra,Taurus Ascendant,703,,,,,,,,,,,,
6,Libra,Moon,Taurus Ascendant,Moon in Libra in 6,	The MOON occupying this sign makes profligacy so deeply rooted that the individual contracts venereal diseases which are difficult to cure. He incurs heavy expenditures and runs into debt.,Owns Houses 3 and ,Libra in 6,Moon in 6,Moon in Libra,Taurus Ascendant,704,,,,,,,,,,,,
6,Libra,Mercury,Taurus Ascendant,Mercury in Libra in 6,	MERCURY in this position obstructs the natives educational career; he loses his money and suffers from both physical and psychological problems.,Owns Houses 2 and 5,Libra in 6,Mercury in 6,Mercury in Libra,Taurus Ascendant,705,,,,,,,,,,,,
6,Libra,Venus,Taurus Ascendant,Venus in Libra in 6,	VENUS can make the person a debauchee with all the associated vices and diseases.,Owns Houses 1 and 6,Libra in 6,Venus in 6,Venus in Libra,Taurus Ascendant,706,,,,,,,,,,,,
6,Libra,Mars,Taurus Ascendant,Mars in Libra in 6,"	When MARS occupies this sign, the individual overcomes the hypoc­risy of everyday life. Though his sexual desires are strong, he struggles to overcome them by his fiery enthusiasm for higher goals. Marital happiness of an enduring kind is denied to him. He will probably be well off financially; though he may face hardships early in life, these are soon overcome.",Owns Houses 12 and 7,Libra in 6,Mars in 6,Mars in Libra,Taurus Ascendant,707,,,,,,,,,,,,
6,Libra,Jupiter,Taurus Ascendant,Jupiter in Libra in 6,"	When JUPITER occupies this sign, the individual achieves command over languages. He establishes clandestine liaisons, but does not generally suffer on that account. His expenditures are on a lavish scale, but he does not incur debts thereby. His physical health is generally sound, and he attains social eminence. The only kannic affliction he suffers is a regret which leaves him always wanting more than he has.",Owns Houses 8 and 11,Libra in 6,Jupiter in 6,Jupiter in Libra,Taurus Ascendant,708,,,,,,,,,,,,
6,Libra,Saturn,Taurus Ascendant,Saturn in Libra in 6,"	When SATURN occupies Libra in the Sixth house, life becomes fairly smooth, with no innate physical problems or humiliating scandals. Past adverse influences are effectively sealed so that the individual only has to face the conditions which arise in his present birth.",Owns Houses 9 and 10,Libra in 6,Saturn in 6,Saturn in Libra,Taurus Ascendant,709,,,,,,,,,,,,
6,Libra,Rahu,Taurus Ascendant,Rahu in Libra in 6,"	With RAHU in the Sixth house, there is intense materialism with much sensitivity at the physical level. The health of the person suffers from a large number of nondescript ailments. For such persons it is useful to take prophylactic measures against any likely disease.",Owns Houses 3 and ,Libra in 6,Rahu in 6,Rahu in Libra,Taurus Ascendant,710,,,,,,,,,,,,
6,Libra,Ketu,Taurus Ascendant,Ketu in Libra in 6,"	KETU will lead to mental anxiety. If Ketu is not affected by any other planetary combination, there may be some physical or psychological factor leading to social ostracism.",Owns Houses 8 and 11,Libra in 6,Ketu in 6,Ketu in Libra,Taurus Ascendant,711,,,,,,,,,,,,
6,Scorpio,Sun,Gemini Ascendant,Sun in Scorpio in 6,"	When the SUN occupies this sign, the conflict is further intensified. There is animosity between the native, his friends, and colleagues whom he treats as friends -but whom he secretly desires to overcome. He is very miserly in his expenditures, denying himself even the necessities, but outwardly he will make a show of generosity in entertaining friends. His personal life will be materialistic and sexual, though he will like to give the impression that he is a moralist. Such contradictions express themselves in psychological instability, and physical problems such as high blood pressure and nervous exhaustion.",Owns Houses 3 and ,Scorpio in 6,Sun in 6,Sun in Scorpio,Gemini Ascendant,712,,,,,,,,,,,,
6,Scorpio,Moon,Gemini Ascendant,Moon in Scorpio in 6,"	The MOON occupying this sign of its debilitation makes the native an eccentric his past karma erupts into his life, so that social calumny confronts him without any provocation on his part. At times the Moon will withdraw its cool judgment, as a result of which the person may be immersed in profligacy. Whatever the immediate cause, the Moon ere.ates some kind of psychological pain.",Owns Houses 2 and ,Scorpio in 6,Moon in 6,Moon in Scorpio,Gemini Ascendant,713,,,,,,,,,,,,
6,Scorpio,Mercury,Gemini Ascendant,Mercury in Scorpio in 6,"	MERCURY is especially difficult here. At worst it can strangle the entire personality and destroy all the finer feelings of the person. It may produce a life of intrigue, unpredictability, and dissatisfied sexual desire. Male sterility or female barrenness can also be produced by this combi­ nation.",Owns Houses 1 and 4,Scorpio in 6,Mercury in 6,Mercury in Scorpio,Gemini Ascendant,714,,,,,,,,,,,,
6,Scorpio,Venus,Gemini Ascendant,Venus in Scorpio in 6,	VENUS in this position is not much better. The voluptuous nature of the person and his extreme indulgences combined with a lack of any sense of family obligation may lead him into problems with venereal disease. He also suffers from financial difficulties and may be greatly dishonored in society.,Owns Houses 12 and 5,Scorpio in 6,Venus in 6,Venus in Scorpio,Gemini Ascendant,715,,,,,,,,,,,,
6,Scorpio,Mars,Gemini Ascendant,Mars in Scorpio in 6,"	MARS in Scorpio is powerful and its impact on accumulated karma is to externalize it and work it out so that its influence for the future is nullified. In order to do this, the individual will meet serious opposition to his way of doing things and to his social nature. When such opposition arises, the individual gets into difficulties and becomes emotionally dried up, But soon the crisis is over and he is free from opposition. Physically, he may suffer from fever, infections, and boils or other skin eruptions.",Owns Houses 11 and 6,Scorpio in 6,Mars in 6,Mars in Scorpio,Gemini Ascendant,716,,,,,,,,,,,,
6,Scorpio,Jupiter,Gemini Ascendant,Jupiter in Scorpio in 6,"	JUPITER'S influence is not easily harmonized. There may be severe physical disease, perhaps dyspepsia or ulcers. The native's marital life will be in the doldrums and he will be in difficulties concerning his heavy expenditures. There is a possibility of his contracting sexually transmitted diseases, though his social status and respectability will be such that no one will talk about his personal life openly.",Owns Houses 7 and 10,Scorpio in 6,Jupiter in 6,Jupiter in Scorpio,Gemini Ascendant,717,,,,,,,,,,,,
6,Scorpio,Saturn,Gemini Ascendant,Saturn in Scorpio in 6,"	SATURN will increase the possibility of hypertension, violent temper, and indecision or wrong decisions which get the native into problematical situations. He may suffer from some ailment of the pelvic region as well as infections of the urinary tract.",Owns Houses 8 and 9,Scorpio in 6,Saturn in 6,Saturn in Scorpio,Gemini Ascendant,718,,,,,,,,,,,,
6,Scorpio,Rahu,Gemini Ascendant,Rahu in Scorpio in 6,"	RAHU produces enmity from low persons with whom the native must finally come to terms. In spite of such reconciliation, the individual may lose some of his social respectability.",Owns Houses 2 and ,Scorpio in 6,Rahu in 6,Rahu in Scorpio,Gemini Ascendant,719,,,,,,,,,,,,
6,Scorpio,Ketu,Gemini Ascendant,Ketu in Scorpio in 6,"	KETU may involve the individual in bizarre sexual relations, and at worst may even lead him to commit criminal &cts. Nevertheless, these activities will be rationalized by him on the basis of some idealistic consideration. His problems will become known and his company will be shunned. He will be rigorously punished for any anti-social behavior.",Owns Houses 7 and 10,Scorpio in 6,Ketu in 6,Ketu in Scorpio,Gemini Ascendant,720,,,,,,,,,,,,
6,Sagittarius,Sun,Cancer Ascendant,Sun in Sagittarius in 6,"With the SUN in this sign, the individual is not necessarily robust. He may have fragile health, and may suffer from indigence, a limited educa­tion, and inability to secure a powerful career. He may undergo serious illnesses, surgery, and a disturbed emotional life. But what the Sun in Sagittarius will do is retrieve from the karmic past the courage and perceptive faculties which can withstand the severest spiritual trials. Under this influence, the individual is also extremely empathic.",Owns Houses 2 and ,Sagittarius in 6,Sun in 6,Sun in Sagittarius,Cancer Ascendant,721,,,,,,,,,,,,
6,Sagittarius,Moon,Cancer Ascendant,Moon in Sagittarius in 6,"	The MOON in this sign produces a versatile genius capable of dedi­cating all his strength and power to the transformation of society. In doing so, he may suffer physical deprivations. Excruciating pain will have to be borne, sometimes to such an extent that the personality will seem com­pletely dissolved. For a younger soul, unprepared for such trials, this combination may impel the individual to dissipate his vital energy, cause suffering from a burning sensation in the stomach, and create heavy debts.",Owns Houses 1 and ,Sagittarius in 6,Moon in 6,Moon in Sagittarius,Cancer Ascendant,722,,,,,,,,,,,,
6,Sagittarius,Mercury,Cancer Ascendant,Mercury in Sagittarius in 6,"	MERCURY in this sign is not very helpful for social relations. It creates a hostile atmosphere around the native. He will be accused of parochial­ ism, bad temper, and will suffer from financial stringency. His relations will try to damage his reputation.",Owns Houses 12 and 3,Sagittarius in 6,Mercury in 6,Mercury in Sagittarius,Cancer Ascendant,723,,,,,,,,,,,,
6,Sagittarius,Venus,Cancer Ascendant,Venus in Sagittarius in 6,"	VENUS causes disharmony with the mother's side of the family. Adverse comments slandering the individual are inflicted upon him by his associates, and he may even be accused of adultery.",Owns Houses 11 and 4,Sagittarius in 6,Venus in 6,Venus in Sagittarius,Cancer Ascendant,724,,,,,,,,,,,,
6,Sagittarius,Mars,Cancer Ascendant,Mars in Sagittarius in 6,"	MARS in this position will be very helpful by way of providing indomitable courage and enthusiasm for overcoming one's enemies and transcending difficulties; it makes the native very energetic. His weakness will arise from his inattention to other people's feelings, his disrespect toward those who are in power, and excessive sexual desire.",Owns Houses 10 and 5,Sagittarius in 6,Mars in 6,Mars in Sagittarius,Cancer Ascendant,725,,,,,,,,,,,,
6,Sagittarius,Jupiter,Cancer Ascendant,Jupiter in Sagittarius in 6,"	JUPITER makes the person suffer from indigestion. He may have some disease of the intestines. He is respected and honored by the state, but will be in debt due to his extravagance.",Owns Houses 6 and 9,Sagittarius in 6,Jupiter in 6,Jupiter in Sagittarius,Cancer Ascendant,726,,,,,,,,,,,,
6,Sagittarius,Saturn,Cancer Ascendant,Saturn in Sagittarius in 6,"	SATURN makes the native specially gifted in spiritual knowledge. He is capable of arduous religious observances. If there are supporting factors, the possibility of attaining enlightenment is great.",Owns Houses 7 and 8,Sagittarius in 6,Saturn in 6,Saturn in Sagittarius,Cancer Ascendant,727,,,,,,,,,,,,
6,Sagittarius,Rahu,Cancer Ascendant,Rahu in Sagittarius in 6,"	RAHU makes the person very materialistic, but he succeeds in his enterprises. He tells lies and is held in low esteem, but he gets his work done. He also attains a high social position and a long life.",Owns Houses 1 and ,Sagittarius in 6,Rahu in 6,Rahu in Sagittarius,Cancer Ascendant,728,,,,,,,,,,,,
6,Sagittarius,Ketu,Cancer Ascendant,Ketu in Sagittarius in 6,"	KETU in this position produces penury but favors enlightenment. There are many hostile forces against the person; he is humiliated, scandalized, and subjected to social obloquy, but he attains supreme detachment almost to the extent of desirelessness. The native is unique in many ways.",Owns Houses 6 and 9,Sagittarius in 6,Ketu in 6,Ketu in Sagittarius,Cancer Ascendant,729,,,,,,,,,,,,
6,Capricorn,Sun,Leo Ascendant,Sun in Capricorn in 6,"	The SUN may cripple the individual physically, but physical incapac­ity will not stand in the way of his achieving his mission in life. The Sun placed in Capricorn will, as a result of the native ’s paying off karmic debts, universalize his consciousness and enable him to do much social service. ",Owns Houses 1 and ,Capricorn in 6,Sun in 6,Sun in Capricorn,Leo Ascendant,730,,,,,,,,,,,,
6,Capricorn,Moon,Leo Ascendant,Moon in Capricorn in 6,"	The MOON in this sign will restrict the mental development of the individual, leaving him at the mercy of karmic forces throughout his life. All his efforts to orient his life in a specific direction according to his desire will be ineffective in the face of destiny. He will live and mix with laborers who have few altruistic notions about life. He will have plenty	of money, but not peace of mind or social respectability.",Owns Houses 12 and ,Capricorn in 6,Moon in 6,Moon in Capricorn,Leo Ascendant,731,,,,,,,,,,,,
6,Capricorn,Mercury,Leo Ascendant,Mercury in Capricorn in 6,	MERCURY in this sign will make the individual insensitive to the feelings of others. He will suffer from diseases of the hands and feet and will incur the enmity of many due to his spoken and written words. His virility will be greatly reduced and he will have financial difficulties.,Owns Houses 11 and 2,Capricorn in 6,Mercury in 6,Mercury in Capricorn,Leo Ascendant,732,,,,,,,,,,,,
6,Capricorn,Venus,Leo Ascendant,Venus in Capricorn in 6,"	VENUS in the Sixth house has a restrictive effect on the sociability of the person, and he will not be successful, establishing a happy conjugal relationship. He will incur hostile feelings from women. some of whom will scandalize him and damage his career. Diseases related to the genito-urinary tract are possible.",Owns Houses 10 and 3,Capricorn in 6,Venus in 6,Venus in Capricorn,Leo Ascendant,733,,,,,,,,,,,,
6,Capricorn,Mars,Leo Ascendant,Mars in Capricorn in 6,"	With MARS in Capricorn, the individual becomes very excitable, always ready to create turmoil. He has very few close friends. He is generally successful in transcending all opposition, but suffers from pain in his stomach. His face may have some scar or other mark of injury.",Owns Houses 9 and 4,Capricorn in 6,Mars in 6,Mars in Capricorn,Leo Ascendant,734,,,,,,,,,,,,
6,Capricorn,Jupiter,Leo Ascendant,Jupiter in Capricorn in 6,"	JUPITER in this sign will damage the relationship with the native's children. His academic degree and interest in spiritual studies will not be of any use in his profession - in which, however, he will attain great success. He may be a bit smug. and though his adversaries will never attack him outright they will secretly seek his downfall or obstruct his path. Jupiter will make the individual wealthy, though he would prefer to feel spiritually evolved. His personal character, affluence, and his desire to be socially helpful will greatly counteract any hostility against him.",Owns Houses 5 and 8,Capricorn in 6,Jupiter in 6,Jupiter in Capricorn,Leo Ascendant,735,,,,,,,,,,,,
6,Capricorn,Saturn,Leo Ascendant,Saturn in Capricorn in 6,"	SATURN will give the native tremendous social and family responsi­bilities to bear. His marital life will not be a success, but he will have very few adversaries. He may be subject to diseases requiring intensive medi­cation or surgery.",Owns Houses 6 and 7,Capricorn in 6,Saturn in 6,Saturn in Capricorn,Leo Ascendant,736,,,,,,,,,,,,
6,Capricorn,Rahu,Leo Ascendant,Rahu in Capricorn in 6,"	RAHU will certainly enable the individual to achieve his mission and overcome any difficulties on the way, but he will associate with mean­ minded and unethical people. He will be liable to prosecution for his underhanded activities; his association with such activities as drug addic­tion, drug trafficking, or smuggling may get him into difficulties, though generally these charges wiII not be substantiated.",Owns Houses 12 and ,Capricorn in 6,Rahu in 6,Rahu in Capricorn,Leo Ascendant,737,,,,,,,,,,,,
6,Capricorn,Ketu,Leo Ascendant,Ketu in Capricorn in 6,"	KETU will make the individual completely non-materialistic in the sense of any covetous attachment to wealth and power. But by virtue of possessing these attributes and utilizing them to help others, the person will earn the goodwill of many. These persons, however, in public or when face to face with the native, will not express their inner regard and appreciation for his character; instead they will often accuse him of a bad temper) of being a hard master and a strict disciplinarian. In fact, the individual will be an austere person, and in spite of his understanding of the failings of others will always encourage them todo better and seriously take them to task -thus justifying the allegations of strictness.",Owns Houses 5 and 8,Capricorn in 6,Ketu in 6,Ketu in Capricorn,Leo Ascendant,738,,,,,,,,,,,,
6,Aquarius,Sun,Virgo Ascendant,Sun in Aquarius in 6,"	Unless he is of an outgoing disposition, the the native with the SUN in Aquarius is always yearning for the love and affection of his family members; he misses the finer qualities of life and remains sensually self-indulgent. His friends and foes are equally unsavory, and he himself may suffer psychological difficulties. Usually this combination does not make the person indigent, though his sexual desires are frequently uncon­trollable and he will go to any lengths to satisfy them.",Owns Houses 12 and ,Aquarius in 6,Sun in 6,Sun in Aquarius,Virgo Ascendant,739,,,,,,,,,,,,
6,Aquarius,Moon,Virgo Ascendant,Moon in Aquarius in 6,"	The MOON in this sign prcoduces a special effect on the life of the person. There is an aura of secrecy about him. He is soft spoken and easily gains one's confidence -a confidence which he may later exploit for his own ends. He is interested in education, the fine arts, music, social organizations and political activities. As a result of these interests he gains a large number of friends and acquaintances. But then, under the guise of such respectable associations, he may engage in seduction, adultery, the misappropriation of wealth which does not belong to him, or the neglect of his own family. He may become a member of secret or exclusive societies.",Owns Houses 11 and ,Aquarius in 6,Moon in 6,Moon in Aquarius,Virgo Ascendant,740,,,,,,,,,,,,
6,Aquarius,Mercury,Virgo Ascendant,Mercury in Aquarius in 6,"	When MERCURY occupies this sign, the individual is clever and gifted with several skills, but his personality is completely subject to the influ­ence of very unenlightened persons. He serves those who do not appreci­ate the finer things in     life and who are uncultured. There is always unhappiness and quarreling in his house. He has bad relations with his neighbors, is extravagant in his expenditures, and immoral in his dealings. He frequently gets into difficulties and is subjected to long-term litigation with little chance of emerging unscathed.",Owns Houses 10 and 1,Aquarius in 6,Mercury in 6,Mercury in Aquarius,Virgo Ascendant,741,,,,,,,,,,,,
6,Aquarius,Venus,Virgo Ascendant,Venus in Aquarius in 6,"	VENUS produces extreme sensuality. Under its influence, the individ­ual often flaunts all religious injunctions and moral tradition with his promiscuity, drunkenness and gambling.",Owns Houses 9 and 2,Aquarius in 6,Venus in 6,Venus in Aquarius,Virgo Ascendant,742,,,,,,,,,,,,
6,Aquarius,Mars,Virgo Ascendant,Mars in Aquarius in 6,"	With MARS in this position, secret schemes may be devised for the native's destruction, but he will escape them. His personal austerity will be extreme, and his missionary zeal will bring relief to the people. He may change his place of residence frequently. Though fragile in constitution, his spiritual attainments will be immense. His death will be sudden and perhaps violent, but his influence on society survives him.",Owns Houses 8 and 3,Aquarius in 6,Mars in 6,Mars in Aquarius,Virgo Ascendant,743,,,,,,,,,,,,
6,Aquarius,Jupiter,Virgo Ascendant,Jupiter in Aquarius in 6,"	JUPITER may create problems with regard to the teeth and stomach. The native's appetite will be poor. He will lose property and his marital life will be unhappy. But he will be respected, renowned for his learning, and will command great authority on spiritual matters. He will have trouble from his associates, but he will be forgiving. He will also be rich. ",Owns Houses 4 and 7,Aquarius in 6,Jupiter in 6,Jupiter in Aquarius,Virgo Ascendant,744,,,,,,,,,,,,
6,Aquarius,Saturn,Virgo Ascendant,Saturn in Aquarius in 6,"	SATURN in this sign is powerful, bestowing longevity, persistence, and the ability to overcome diseases by force of will and fight the ordeals of life with equanimity. His troubles will originate from his sectarianism; his children will also bring him much worry. In spite of opposition and difficulties in his community, he will make a success of his life.",Owns Houses 5 and 6,Aquarius in 6,Saturn in 6,Saturn in Aquarius,Virgo Ascendant,745,,,,,,,,,,,,
6,Aquarius,Rahu,Virgo Ascendant,Rahu in Aquarius in 6,"	RAHU occupying this sign will make everyone the native's antagonist. His language may be offensive and he may be much disliked. Even his spouse and child may have scant respect for him. There will, however, be order in his life, idealism in his approach, and comfort in his living.",Owns Houses 11 and ,Aquarius in 6,Rahu in 6,Rahu in Aquarius,Virgo Ascendant,746,,,,,,,,,,,,
6,Aquarius,Ketu,Virgo Ascendant,Ketu in Aquarius in 6,"	KETU in this position will bring cataclysmic changes to the person's life, resulting from the distrust, humiliation, and animosity generated by his colleagues and associates. After attaining great proficiency in his trade, he will be forced to alter his life pattern; after having confronted opposi­tion from several quarters, he will gain equanimity and spend his time more or less like a recluse. He will seldom open his inner feelings and ideas to others, and he will experience a great metamorphosis in life.",Owns Houses 4 and 7,Aquarius in 6,Ketu in 6,Ketu in Aquarius,Virgo Ascendant,747,,,,,,,,,,,,
6,Piscis,Sun,Libra Ascendant,Sun in Piscis in 6,"	The SUN in this position creates much trouble for the individual concerned. Enemies, debts and diseases come to him in many forms. However, he successfully intimidates and scheme-.s against his opponents, destroying their united attack on him. Local government itself may disturb his mental peace, and precipitate humiliating actions against him. In spite of all these difficulties the individual suffers only minor repercussions and is by and large protected against major calamities.",Owns Houses 11 and ,Piscis in 6,Sun in 6,Sun in Piscis,Libra Ascendant,748,,,,,,,,,,,,
6,Piscis,Moon,Libra Ascendant,Moon in Piscis in 6,"	The MOON, however, fails to protect the native. It makes him vulner­able to severe hostile onslaughts. In public office, the situation may deteriorate to such an extent that he may face suspension or demotion. Physically he may be afflicted with pleurisy or indigestion His expenditures will much exceed his income and he will be in debt. Allegations of moral turpitude may be leveled against him.",Owns Houses 10 and ,Piscis in 6,Moon in 6,Moon in Piscis,Libra Ascendant,749,,,,,,,,,,,,
6,Piscis,Mercury,Libra Ascendant,Mercury in Piscis in 6,"	MERCURY in Pisces will make the individual greatly devoted to spirituality. He will have little money, but a very devoted and efficient spouse. He himself will mostly be engaged in deep contemplation, leaving the management of family affairs to the spouse.",Owns Houses 9 and 12,Piscis in 6,Mercury in 6,Mercury in Piscis,Libra Ascendant,750,,,,,,,,,,,,
6,Piscis,Venus,Libra Ascendant,Venus in Piscis in 6,"	VENUS in this position makes the individual extremely sensitive to the feelings of others. He will be a highly evolved soul who will be subjected to much misunderstanding. His equanimity of mind and refined perceptivity will raise him above the pain and sorrow of debt, disease and humiliation. He will be well off as far as money is concerned. His comprehension of situations will be very sharp, and his power to tackle his opponents will be adequate. He will move in the higher echelons of society.",Owns Houses 8 and 1,Piscis in 6,Venus in 6,Venus in Piscis,Libra Ascendant,751,,,,,,,,,,,,
6,Piscis,Mars,Libra Ascendant,Mars in Piscis in 6,	MARS will make the person voluptuous; his marital fidelity will be questionable. But he will be well-provided with money and will have sufficient power to overcome the various adversaries he will encounter in life.,Owns Houses 7 and 2,Piscis in 6,Mars in 6,Mars in Piscis,Libra Ascendant,752,,,,,,,,,,,,
